{
  "schema_version": "job-skill-safety-technical-review-result-v1",
  "result_id": "job-skill-safety-tech-review-20260719031839",
  "status": "SUBMITTED",
  "package": {
    "package_id": "job-skill-shelver-pilot-safety-technical-review-packet-v2",
    "package_version": 2,
    "manifest_id": "strategy_job_skill_shelver_v1@2-pilot-r1",
    "manifest_version": 2
  },
  "strategy": {
    "strategy_id": "strategy_job_skill_shelver_v1",
    "strategy_version": 2
  },
  "reviewer": {
    "name": "赫东",
    "roles": [
      "SAFETY_REVIEWER",
      "TECHNICAL_REVIEWER"
    ],
    "reviewed_date": "2026-07-19",
    "submitted_at": "2026-07-19T03:18:39.213Z"
  },
  "summary": {
    "total": 24,
    "technical_pass": 11,
    "technical_return": 13,
    "safety_pass": 19,
    "safety_return": 5,
    "sensitive": 18,
    "not_sensitive": 6,
    "content_reconfirmation_pending": 13
  },
  "questions": [
    {
      "question_id": "M1_SC_001",
      "question_version": 1,
      "candidate_record_hash": "sha256:94a9c099f685859ed54827ed349861ed9558faa46ee0f273580597cd0a320f0f",
      "renderer_review": "PASS",
      "data_contract_review": "PASS",
      "material_tool_review": "PASS",
      "technical_conclusion": "PASS",
      "safety_sensitive_decision": "NOT_SENSITIVE",
      "safety_review": "PASS",
      "safety_conclusion": "PASS",
      "stop_conditions": "无额外停止条件（图文判断题，不涉及现场操作）。",
      "technical_note": "题干、选项和答案链条完整；A符合正面朝外、竖直稳定和同排前沿整齐的基础陈列要求。",
      "safety_note": "正确答案不会引导危险操作；正式配图须避免出现商品斜靠、悬空或易坠落。"
    },
    {
      "question_id": "M1_SC_004",
      "question_version": 1,
      "candidate_record_hash": "sha256:8a8faba96ee9a7c2579f1f050b6df68317cce5ed82686173edb70ff555688f44",
      "renderer_review": "PASS",
      "data_contract_review": "PASS",
      "material_tool_review": "PASS",
      "technical_conclusion": "PASS",
      "safety_sensitive_decision": "SENSITIVE",
      "safety_review": "PASS",
      "safety_conclusion": "PASS",
      "stop_conditions": "图文题无实物操作；若配图出现5升桶装水置于高层、货架超载或取放需攀爬，停止上线并更换素材。",
      "technical_note": "B符合重物低位、轻物较高位的基础原则；实际层位仍须服从门店陈列图、货架额定承重和安全触达高度。",
      "safety_note": "重物下置可降低坠落、货架失稳和高位搬取风险，安全通过。"
    },
    {
      "question_id": "M1_SC_007_V2",
      "question_version": 2,
      "candidate_record_hash": "sha256:869a6be7300ed814de50f1a227d0874ce02a1a23f6d78ee8b92421de0f2faa8b",
      "renderer_review": "PASS",
      "data_contract_review": "PASS",
      "material_tool_review": "PASS",
      "technical_conclusion": "PASS",
      "safety_sensitive_decision": "NOT_SENSITIVE",
      "safety_review": "PASS",
      "safety_conclusion": "PASS",
      "stop_conditions": "无额外停止条件（图文判断题，不涉及现场操作）。",
      "technical_note": "A为唯一最佳答案，覆盖品名、规格或条码对应关系以及售价、促销有效期；实际门店应以系统价签和门店核价流程为准。",
      "safety_note": "不涉及直接人身风险；正确核价可减少错售和顾客争议。"
    },
    {
      "question_id": "M1_OP_033_V2",
      "question_version": 2,
      "candidate_record_hash": "sha256:8334119d703c2da13812f110025ba185346df22a4cc9466edf6986fedbf543f4",
      "renderer_review": "RETURN",
      "data_contract_review": "PASS",
      "material_tool_review": "PASS",
      "technical_conclusion": "RETURN_FOR_REVISION",
      "safety_sensitive_decision": "SENSITIVE",
      "safety_review": "PASS",
      "safety_conclusion": "PASS",
      "stop_conditions": "货架晃动、商品有尖锐边角或超出安全触达高度时不得开始；出现攀爬、踩踏货架、抛放商品或商品连续倾倒时立即停止。",
      "technical_note": "题目、工具和0/1/2分锚点本身可执行，但已知学习端未渲染题干、工具和评分锚点；修复实际渲染并复验前，技术结论退回。",
      "safety_note": "限定稳定迷你货架和轻型无尖角商品，停止条件覆盖主要坠落与攀爬风险，安全通过。"
    },
    {
      "question_id": "M2_SC_002_V2",
      "question_version": 2,
      "candidate_record_hash": "sha256:9595043891dc4a322e92d429e0bb6f916112ccc2e44f99ea9c7680eb28743add",
      "renderer_review": "PASS",
      "data_contract_review": "PASS",
      "material_tool_review": "PASS",
      "technical_conclusion": "PASS",
      "safety_sensitive_decision": "NOT_SENSITIVE",
      "safety_review": "PASS",
      "safety_conclusion": "PASS",
      "stop_conditions": "无额外停止条件（图文判断题，不涉及现场操作）。",
      "technical_note": "A正确表达有到期日食品的FEFO：较早到期批次置于顾客先拿取位置，较晚到期批次后置；不得用到货先后替代效期核对。",
      "safety_note": "正确答案不会引导危险操作，并能降低商品过期仍留架的风险。"
    },
    {
      "question_id": "M2_SC_003",
      "question_version": 1,
      "candidate_record_hash": "sha256:49a332636566da4710b9924d9bafc452f3ffbfa0b972aa6dc303618768abe0a1",
      "renderer_review": "PASS",
      "data_contract_review": "PASS",
      "material_tool_review": "RETURN",
      "technical_conclusion": "RETURN_FOR_REVISION",
      "safety_sensitive_decision": "SENSITIVE",
      "safety_review": "RETURN",
      "safety_conclusion": "RETURN_FOR_REVISION",
      "stop_conditions": "本题当前不得激活。须把“避免刀刃伤及本人或他人”设为最高优先项，并明确安全刀具、切割方向、手部位置、最小出刃量及破损刀具停用后再复审。",
      "technical_note": "现答案A只强调下刀过深划伤商品，却遗漏刀具作业首要风险——人员割伤；“最需要避免”的标准答案因此不专业且优先级错误。",
      "safety_note": "学员照答案学习可能只控制深度保护商品，却仍朝身体方向切割或把手置于刀路，存在割伤风险，安全不通过。"
    },
    {
      "question_id": "M2_SC_005_V2",
      "question_version": 2,
      "candidate_record_hash": "sha256:cd1284933c518e8175dcddf5d2160e4ef94e8ccef9a805f5f6aa9517e8c47c62",
      "renderer_review": "PASS",
      "data_contract_review": "PASS",
      "material_tool_review": "RETURN",
      "technical_conclusion": "RETURN_FOR_REVISION",
      "safety_sensitive_decision": "SENSITIVE",
      "safety_review": "RETURN",
      "safety_conclusion": "RETURN_FOR_REVISION",
      "stop_conditions": "本题当前不得激活。须固定一个早于2026-08-10的模拟工作日，并注明两批次均在可正常销售状态；任一批次已过期时必须退出正常上架流程。",
      "technical_note": "在两批次均可售的前提下A符合FEFO，但题干未给施测日期；日期型题日后复用时可能出现两批均已过期，答案将不再成立。",
      "safety_note": "缺少固定工作日会在过期后仍引导把批次A放到顾客先拿取位置，可能造成过期商品销售，安全不通过。"
    },
    {
      "question_id": "M2_OP_027_V2",
      "question_version": 2,
      "candidate_record_hash": "sha256:b8ad484b15ab1ab1b8161cba94d093fff6bd818def9376784fa32c0676614ae5",
      "renderer_review": "RETURN",
      "data_contract_review": "PASS",
      "material_tool_review": "PASS",
      "technical_conclusion": "RETURN_FOR_REVISION",
      "safety_sensitive_decision": "SENSITIVE",
      "safety_review": "PASS",
      "safety_conclusion": "PASS",
      "stop_conditions": "不得提供刀具；纸箱或内装超出预设轻量范围、台面不稳、用牙咬、踩箱、朝身体猛拉、商品泄漏或玻璃破裂时立即停止。",
      "technical_note": "徒手易撕训练箱、工具、步骤与评分锚点可执行；但已知学习端未渲染题干、工具和锚点，修复并实机复验前技术退回。",
      "safety_note": "无刀具、无玻璃、稳定台面和轻量内装已控制主要风险，停止条件明确，安全通过。"
    },
    {
      "question_id": "M3_SC_001_V2",
      "question_version": 2,
      "candidate_record_hash": "sha256:9d71f2fc33b797912d86b7dc71cd996fc29b71c993fffaf860ada5a589a05e11",
      "renderer_review": "PASS",
      "data_contract_review": "PASS",
      "material_tool_review": "PASS",
      "technical_conclusion": "PASS",
      "safety_sensitive_decision": "SENSITIVE",
      "safety_review": "PASS",
      "safety_conclusion": "PASS",
      "stop_conditions": "图文题无实物操作；若素材日期模糊、标签不是“保质期至”或施测基准日显示错误，停止上线并更换素材。",
      "technical_note": "基准日为2026-06-02，包装标注保质期至2026-06-01，A为唯一正确处理：停止正常销售并按门店流程隔离。",
      "safety_note": "正确答案可防止超过标示日期的商品继续销售，安全通过。"
    },
    {
      "question_id": "M3_SC_005",
      "question_version": 1,
      "candidate_record_hash": "sha256:7e503aa45a1d3acb55e9c6d5d7885a97fa3948a860586b6146a80ca8c80b0b17",
      "renderer_review": "PASS",
      "data_contract_review": "PASS",
      "material_tool_review": "PASS",
      "technical_conclusion": "PASS",
      "safety_sensitive_decision": "SENSITIVE",
      "safety_review": "PASS",
      "safety_conclusion": "PASS",
      "stop_conditions": "图文题无实物操作；若系统显示的基准日期、剩余天数与题干不一致，停止上线。",
      "technical_note": "题干明确门店阈值为不足15天且固定日期为2026-07-04，B剩余11天，答案唯一；15天边界口径应在同一题库保持一致。",
      "safety_note": "判断规则明确，不会引导销售过期商品，安全通过。"
    },
    {
      "question_id": "M3_SC_019_V2",
      "question_version": 2,
      "candidate_record_hash": "sha256:7569ef8e80b9f14a316dde59717569fee35f5e930bedae85bc27e6caf9b7cb21",
      "renderer_review": "PASS",
      "data_contract_review": "PASS",
      "material_tool_review": "PASS",
      "technical_conclusion": "PASS",
      "safety_sensitive_decision": "SENSITIVE",
      "safety_review": "PASS",
      "safety_conclusion": "PASS",
      "stop_conditions": "图文题无实物操作；若配图把临期品与过期品放在同一可售区域，或未显示隔离/醒目标识和登记上报，停止上线。",
      "technical_note": "A符合基础流程：停止正常补货，隔离或醒目标识、登记并按门店授权流程处理；临期可售区与后台待处理区须在培训中区分。",
      "safety_note": "答案没有要求擅自丢弃或继续正常陈列，能控制误售风险，安全通过。"
    },
    {
      "question_id": "M3_OP_043_V2",
      "question_version": 2,
      "candidate_record_hash": "sha256:3d65d282352fe7d7aa9d69d65fad13be3fb21d075512933782444af657cd6eec",
      "renderer_review": "RETURN",
      "data_contract_review": "PASS",
      "material_tool_review": "PASS",
      "technical_conclusion": "RETURN_FOR_REVISION",
      "safety_sensitive_decision": "SENSITIVE",
      "safety_review": "PASS",
      "safety_conclusion": "PASS",
      "stop_conditions": "仅使用明显标注“教具/不可食用”的训练品；真实过期食品、标签脱落或模糊、模拟日期与标准答案不一致时立即停止并更换材料。",
      "technical_note": "日期、标准映射、区域和评分锚点均可执行；但学习端未渲染题干、工具和评分锚点，修复并实机复验前技术退回。",
      "safety_note": "当天到期品与已过期品分区明确，且禁止真实过期食品回流销售或食用链，安全通过。"
    },
    {
      "question_id": "M4_SC_001",
      "question_version": 1,
      "candidate_record_hash": "sha256:bcdb9930be256fd640cae22008801a2466c2edf3c594aacf962a266f093cf076",
      "renderer_review": "PASS",
      "data_contract_review": "PASS",
      "material_tool_review": "PASS",
      "technical_conclusion": "PASS",
      "safety_sensitive_decision": "SENSITIVE",
      "safety_review": "PASS",
      "safety_conclusion": "PASS",
      "stop_conditions": "图文题无实物操作；若配图出现堵塞通道/消防设施、堆码不稳、重物高置或超载，停止上线并更换素材。",
      "technical_note": "B是给定选项中的唯一正确基础做法；正式培训还须补充按品项/库位/批次管理、通道与消防净空、货架承重及门店堆码标准。",
      "safety_note": "重下轻上和分区摆放可降低坠落、倒塌和搬运风险，安全通过。"
    },
    {
      "question_id": "M4_SC_003",
      "question_version": 1,
      "candidate_record_hash": "sha256:dae1d91beb7387735d3816248d538ba44313bca6854a37388496065cb8e9fbf6",
      "renderer_review": "PASS",
      "data_contract_review": "PASS",
      "material_tool_review": "PASS",
      "technical_conclusion": "PASS",
      "safety_sensitive_decision": "SENSITIVE",